FACID,FACILITY_TYPE,LIC#,LICENSED_NAME,ALPHA_NAME,ADDRESS,FAC_ADDR_2,FAC_CITY,FAC_ST,ZIP,CSZ,COUNTY,TELEPHONE,FAXPHONE,FACEMAIL,LIC_EXPIRES,LICENSED_OWNER,OWNADDR,owncsz,OwnDesc,ADMIN,TITLE,RunDate,HospBedTotal
NJ1505,"HOSPITAL-BASED, OFF-SITE AMBULATORY CARE FACILITY",1505,234 BUILDING,234 BUILDING,234 HAMBURG TURNPIKE, ,WAYNE,NJ,07470,"WAYNE, NJ  07470",PASSAIC,(973) 754-2002,(973) 754-2009,,10/31/2020,ST. JOSEPH'S REGIONAL MEDICAL CENTER,703 MAIN STREET,"PATERSON, NJ  07503",,Mr. KEVIN SLAVIN,,6/17/2020,
NJ23345,AMBULATORY CARE FACILITY,23345,60TH STREET MRI,60TH STREET MRI,6001 MONROE PLACE, ,WEST NEW YORK,NJ,07093,"WEST NEW YORK, NJ  07093",HUDSON,(201) 854-1200,(201) 854-3333,NORTHJERSEYIMAGING@GMAIL.COM,6/30/2021,"RICARDO T. BALDONADO, M.D.",307-60TH STREET,"WEST NEW YORK, NJ  07093",,Dr. RICARDO BALDONADO,DIRECTOR,6/17/2020,
NJ24672,AMBULATORY CARE FACILITY,24672,"95 MADISON IMAGING CENTER AT MORRISTOWN, PC","95 MADISON IMAGING CENTER AT MORRISTOWN, PC",95 MADISON AVENUE, ,MORRISTOWN,NJ,07960,"MORRISTOWN, NJ  07960",MORRIS,(201) 262-2200,(201) 262-1553,,9/30/2020,95 MADISON IMAGING CENTER AT MORRISTOWN PC,95 MADISON AVENUE,"MORRISTOWN, NJ  07960",Profit - Corporation,Ms. DENISE LUBRANO,,6/17/2020,
NJ22911,AMBULATORY CARE FACILITY,22911,"A. P. DIAGNOSTIC IMAGING, INC.","A P DIAGNOSTIC IMAGING, INC","1692 OAK TREE ROAD, SUITE 25", ,EDISON,NJ,08820,"EDISON, NJ  08820",MIDDLESEX,(732) 635-9729,(732) 906-7801,harshadpatel1@msn.com,8/31/2020,A P DIAGNOSTIC IMAGING,1692 OAK TREE ROAD,"EDISON, NJ  08820",,Dr. STEVE LOSIK,,6/17/2020,
NJ24104,HOSPICE CARE PROGRAM,24104,ACACIA HOSPICE,ACACIA HOSPICE,902 JACKSONVILLE ROAD, ,BURLINGTON,NJ,08016,"BURLINGTON, NJ  08016",BURLINGTON,(609) 589-4444,(609) 589-4034,dan@njmasonic.org,5/31/2021,MASONIC CHARITY FOUNDATION OF NJ,902 JACKSONVILLE ROAD,"BURLINGTON, NJ  08016",NonProfit - Corporation,"Mr. ROBERT SPOSATO, MBA, MSN, RN",,6/17/2020,
NJ24265,AMBULATORY SURGICAL CENTER,24265,ACCELERATED SURGICAL CENTER OF NORTH JERSEY LLC,ACCELERATED SURGICAL CENTER OF NORTH JERSEY LLC,"680 BROADWAY, SUITE 203", ,PATERSON,NJ,07514,"PATERSON, NJ  07514",PASSAIC,(973) 225-0732,(973) 968-6660,SAMRAHAT@GMAIL.COM,7/31/2020,ACCELERATED SURGICAL CENTER OF NORTH JERSEY LLC,"680 BROADWAY, SUITE 204","PATERSON, NJ  07514",,Mr. SAM RAHAT,,6/17/2020,
NJ31C0001083,AMBULATORY SURGICAL CENTER,22935,ACCESS,ACCESS,"3205 FIRE ROAD, SUITE 3", ,EGG HARBOR TOWNSHIP,NJ,08234,"EGG HARBOR TOWNSHIP, NJ  08234",ATLANTIC,(609) 407-1113,(609) 407-0330,jmadden@acesssurgi.com,7/31/2020,"ATLANTIC GASTRO SURGICENTER, L.L.C.","3205 FIRE ROAD, SUITE 3","EGG HARBOR TOWNSHIP, NJ  08234",Profit - LLC,Dr. BARRY KAUFMAN,,6/17/2020,
NJ24714R,AMBULATORY SURGICAL CENTER,R24714,ACCESS CARE PHYSICIANS OF NJ L.L.C.,ACCESS CARE PHYSICIANS OF NJ LLC,"1050 GALLOPING HILL ROAD, SUITE 101", ,UNION,NJ,07083,"UNION, NJ  07083",UNION,(908) 686-0123,(908) 686-0014,ilana.horowitz@azuracare.com,11/30/2020,"ACCESS CARE PHYSICIANS OF NJ, L.L.C.","2401 MORRIS AVENUE, SUITE W-112","UNION, NJ  07083",Profit - LLC,. ILANA HOROWITZ,,6/17/2020,
NJ24374A,SPECIAL HOSPITAL,24374,ACUITY SPECIALTY HOSPITAL OF NEW JERSEY,ACUITY SPECIALTY HOSPITAL OF NEW JERSEY,1925 PACIFIC AVENUE 5TH FLOOR, ,ATLANTIC CITY,NJ,08401,"ATLANTIC CITY, NJ  08401",ATLANTIC,(609) 441-2122,(609) 441-2169,admilgrim@acuityhealthcare.net,11/30/2020,"ACUITY HEALTHCARE, L.P.","10735 DAVID TAYLOR DR, SUITE 200","CHARLOTTE, NC  28262",Profit - Corporation,Ms. KATHLEEN KERSTETTER,,6/17/2020,30
NJ23471A,SPECIAL HOSPITAL,23471,ACUITY SPECIALTY HOSPITAL OF SOUTHERN NEW JERSEY,ACUITY SPECIALTY HOSPITAL OF SOUTHERN NEW JERSEY,218 SUNSET ROAD, ,WILLINGBORO,NJ,08046,"WILLINGBORO, NJ  08046",BURLINGTON,(609) 432-3034,(609) 835-5784,garneson@acuityhealthcare.net,10/31/2020,LOURDES SPECIALTY HOSPITAL OF SOUTHERN NEW JERSEY,218 SUNSET ROAD,"WILLINGBORO, NJ  08046",Profit - LLC,Mr. GARRETT ARNESON,,6/17/2020,69
NJ22548,AMBULATORY CARE FACILITY,22548,"ADVANCED DIAGNOSTIC IMAGING OF NEW JERSEY, INC",ADVANCED DIAGNOSTIC IMAGING OF NEW JERSEY,34 ROUTE 17 NORTH, ,PARAMUS,NJ,07652,"PARAMUS, NJ  07652",BERGEN,(201) 368-2005,(201) 368-1431,office@openmri17.com,12/31/2020,"ADVANCED DIAGNOSTIC IMAGING OF NEW JERSEY, INC",34 ROUTE 17 NORTH,"PARAMUS, NJ  07652",,. JONATHAN MORA,,6/17/2020,
NJ23487,AMBULATORY CARE FACILITY,23487,ADVANCED DIAGNOSTICS OF NEW JERSEY,ADVANCED DIAGNOSTICS OF NEW JERSEY,701 ROUTE 38 EAST, ,CHERRY HILL,NJ,08002,"CHERRY HILL, NJ  08002",CAMDEN,(856) 486-9000,(856) 486-9149,,10/31/2020,"ADVANCED DIAGNOSTICS OF NEW JERSEY, INC.",701 ROUTE 38 EAST,"CHERRY HILL, NJ  08002",Profit - Corporation,Dr. GEORGE RODRIGUEZ,,6/17/2020,
NJ31C0001154,AMBULATORY SURGICAL CENTER,24268,ADVANCED ENDOSCOPY AND SURGICAL CENTER,ADVANCED ENDOSCOPY & SURGICAL CENTER,"142 ROUTE 35, SUITE 101", ,EATONTOWN,NJ,07724,"EATONTOWN, NJ  07724",MONMOUTH,(732) 935-0031,(732) 935-0032,Tdelnero@amsurg.com,1/31/2021,ADVANCED ENDOSCOPY & SURGICAL CENTER LLC,"142 ROUTE 35, SUITE 101","EATONTOWN, NJ  07724",Profit - LLC,Ms. TARA DELNERO,,6/17/2020,
NJ22788,AMBULATORY CARE FACILITY,22788,"ADVANCED MAGNETIC IMAGING ASSOCIATES, P.A.","ADVANCED MAGNETIC IMAGING ASSOCIATES, PA",6410-6416 BERGENLINE AVENUE, ,WEST NEW YORK,NJ,07093,"WEST NEW YORK, NJ  07093",HUDSON,(201) 295-1099,(201) 295-1035,amiwny@optonline.net,9/30/2020,"AHSAN ZAFAR, M.D.",1712 LINVALE-HARBOURTON ROAD,"HAMILTON, NJ  08530",Profit - Corporation,Mr. SAMI CHAUDHARY,,6/17/2020,
NJ24090,AMBULATORY CARE FACILITY,24090,ADVANCED MEDICAL  IMAGING OF TOMS RIVER,ADVANCED MEDICAL IMAGING OF TOMS RIVER,1430 HOOPER AVENUE, ,TOMS RIVER,NJ,08753,"TOMS RIVER, NJ  08753",OCEAN,(732) 349-2867,(732) 349-3810,HHACKER@EIARAD.COM,8/31/2020,ROBERT WOOD JOHNSON JR. LIFESTYLE INSTITUTE INC.,98 JAMES STREET 4TH FLOOR,"EDISON, NJ  08820",,Mr. RAYMOND FREDERICKS,,6/17/2020,
NJ24982,AMBULATORY CARE FACILITY,24982,ADVANCED MEDICAL EMERGENCY RESOURCE COALITION INC,ADVANCED MEDICAL EMERGENCY RESOURCE COALITION INC,"842 SILVIA STREET, ENTERPRISE PARK, BLDG D", ,WEST TRENTON,NJ,08628,"WEST TRENTON, NJ  08628",MERCER,(732) 744-5822,          ,,4/30/2020,ADVANCED MEDICAL EMERGENCY RESOURCE COALITION INC,30 PROSPECT AVENUE,"HACKENSACK, NJ  07601",,Mr. ADAM BEDER,,6/17/2020,
NJ24983,AMBULATORY CARE FACILITY,24983,ADVANCED MEDICAL EMERGENCY RESOURCE COALITION INC,ADVANCED MEDICAL EMERGENCY RESOURCE COALITION INC,"842 SILVIA STREET, ENTERPRISE PARK, BLGD D", ,WEST TRENTON,NJ,08628,"WEST TRENTON, NJ  08628",MERCER,(732) 744-5822,          ,,4/30/2020,ADVANCED MEDICAL EMERGENCY RESOURCE COALITION INC,30 PROSPECT AVENUE,"HACKENSACK, NJ  07601",,Mr. ADAM BEDER,,6/17/2020,
NJ23131,"HOSPITAL-BASED, OFF-SITE AMBULATORY CARE FACILITY",1306,ADVANCED MEDICAL IMAGING OF ENGLEWOOD HOSPITAL,ADVANCED MEDICAL IMAGING OF ENGLEWOOD HOSPITAL,452 OLD HOOK ROAD, ,EMERSON,NJ,07630,"EMERSON, NJ  07630",BERGEN,(201) 262-0001,(201) 262-2330,warren.geller@ehmchealth.org,6/30/2021,ENGLEWOOD HOSPITAL AND MEDICAL CENTER,350 ENGLE STREET,"ENGLEWOOD, NJ  07631",,. WARREN GELLER,,6/17/2020,
NJ22989,AMBULATORY CARE FACILITY,22989,ADVANCED MEDICAL IMAGING OF OLD BRIDGE,ADVANCED MEDICAL IMAGING OF OLD BRIDGE,3548 ROUTE 9 SOUTH, ,OLD BRIDGE,NJ,08857,"OLD BRIDGE, NJ  08857",MIDDLESEX,(732) 970-0420,(732) 970-0517,HAZEL.HACKER@HACKENSACKMERIDIAN.ORG,1/31/2021,ROBERT WOOD JOHNSON JR. LIFESTYLE INSTITUTE INC.,98 JAMES STREET 4TH FLOOR,"EDISON, NJ  08820",,. AMIE THORNTON,,6/17/2020,
NJ24803,AMBULATORY CARE FACILITY,24803,ADVANCED OPEN MRI OF WEST HUDSON,ADVANCED OPEN MRI OF WEST HUDSON,723 ELM STREET, ,KEARNY,NJ,07032,"KEARNY, NJ  07032",HUDSON,(201) 997-7300,(201) 997-2709,SUBOOHAZ@GMAIL.COM,3/31/2020,SKS HEALTHCARE LLC,1712 LINVALE HARBOURTON ROAD,"LAMBERTVILLE, NJ  08530",,Mr. JOSEPH MALGERI,,6/17/2020,
NJ1399,AMBULATORY CARE FACILITY,24785,ADVANCED PRACTICE IMAGING,ADVANCED PRACTICE IMAGING,30 BERGEN STREET, ,NEWARK,NJ,07103,"NEWARK, NJ  07103",ESSEX,(973) 972-5188,(973) 972-7429,kortbame@uhnj.org,3/31/2021,"RUTGERS HEALTH GROUP, INC.",83 FRENCH STREET,"NEW BRUNSWICK, NJ  08901",Govt - Hospital,Dr. ROBERT JOHNSON,,6/17/2020,
NJ24953,AMBULATORY CARE FACILITY,24953,"ADVANCED SHORE IMAGING ASSOCIATES, LLC",ADVANCED SHORE IMAGING ASSOCIATES LLC,"2605 SHORE ROAD, SUITE 101", ,NORTHFIELD,NJ,08225,"NORTHFIELD, NJ  08225",ATLANTIC,(609) 380-4175,(609) 377-8249,kredington@advancedshareimaging.com,1/31/2021,"ADVANCED SHORE IMAGING ASSOCIATES, L.L.C.","2605 SHORE ROAD, SUITE 101","NORTHFIELD, NJ  08225",,. KAREN REDINGTON,,6/17/2020,
NJ24266,AMBULATORY SURGICAL CENTER,24266,"ADVANCED SPINE AND OUTPATIENT SURGERY CENTER, LLC","ADVANCED SPINE AND OUTPATIENT SURGERY CENTER, LLC","855 LEHIGH AVENUE, SUITE 203", ,UNION,NJ,07083,"UNION, NJ  07083",UNION,(908) 557-9420,(908) 557-9438,IIglesias@advancedspine.com,10/31/2020,"ADVANCED SPINE AND OUTPATIENT SURGERY CENTER, LLC","855 LEHIGH AVENUE, SUITE 203","UNION, NJ  07083",Profit - LLC,. NATALIA DIAZ,,6/17/2020,
NJ25070,AMBULATORY CARE FACILITY,25070,"ADVANCED SPINE CARE AND PHYSICAL REHABILITATION, LLC",ADVANCED SPINE CARE AND PHYSICAL REHABILITATION LL,"728 BENNETTS MILLS ROAD, SUITE 1", ,JACKSON,NJ,08527,"JACKSON, NJ  08527",OCEAN,(732) 415-1401,(732) 415-1403,,9/30/2020,NORTHEAST SPINE & SPORTS MEDICINE,728 BENNETTS MILLS,"JACKSON, NJ  08527",,Dr. LAMBROS LAMBROU,,6/17/2020,
NJ90046,AMBULATORY SURGICAL CENTER,R24605,"ADVANCED SURGERY CENTER OF CLIFTON, LLC","ADVANCED SURGERY CENTER OF CLIFTON, LLC",1200 ROUTE 46 WEST, ,CLIFTON,NJ,07013,"CLIFTON, NJ  07013",PASSAIC,(973) 773-5600,(973) 773-5009,MCUELLARAS@gmail.com,10/31/2020,"ADVANCED SURGERY CENTER OF CLIFTON, LLC",1200 ROUTE 46 WEST,"CLIFTON, NJ  07013",Profit - Corporation,Ms. MARILYN CUELLAR-FERNANDEZ,,6/17/2020,
NJ22469,AMBULATORY SURGICAL CENTER,22469,"ADVANCED SURGERY CENTER, LLC","ADVANCED SURGERY CENTER, LLC","1608 LEMOINE AVENUE, SUITE 101", ,FORT LEE,NJ,07024,"FORT LEE, NJ  07024",BERGEN,(201) 585-9921,(201) 585-9799,d.oscar@advancedscrnj.com,5/31/2021,"ADVANCED SURGERY CENTER, LLC","1608 LEMOINE AVENUE, SUITE 101","FORT LEE, NJ  07024",Profit - LLC,Mrs. KETLANDE OSCAR,,6/17/2020,
NJ90075,AMBULATORY SURGICAL CENTER,R24526,"ADVANCED SURGICAL ARTS CENTER, LLC","ADVANCED SURGICAL ARTS CENTER, LLC",1150 AMBOY AVENUE, ,EDISON,NJ,08837,"EDISON, NJ  08837",MIDDLESEX,(732) 548-8194,(732) 548-1919,plasticsdoc10@yahoo.com,1/31/2021,"ADVANCED SURGICAL ARTS CENTER, LLC",1150 AMBOY AVENUE,"EDISION, NJ  08837",Profit - LLC,Dr. ANDREW MILLER,M.D.,6/17/2020,
NJ24201,AMBULATORY SURGICAL CENTER,24201,ADVANCED SURGICAL INSTITUTE,ADVANCED SURGICAL INSTITUTE,556 EGG HARBOR ROAD, ,SEWELL,NJ,08080,"SEWELL, NJ  08080",GLOUCESTER,(856) 256-7620,(856) 256-7621,jyondura@sjmi.virtua.org,7/31/2020,SOUTH JERSEY MUSCULOSKELETAL INSTITUTE,"556 EGG HARBOR ROAD, SUITE B","SEWELL, NJ  08080",Profit - Corporation,Mr. JAMES YONDURA,R.N.,6/17/2020,
NJ24516,AMBULATORY CARE FACILITY,24516,ADVANTAGE SLEEP ASSOCIATES,ADVANTAGE SLEEP ASSOCIATES,"2301 EVESHAM ROAD,  SUITE 603-604", ,VOORHEES,NJ,08043,"VOORHEES, NJ  08043",CAMDEN,(856) 424-2000,(856) 424-2007,cherylk@adtherapy.com,5/31/2021,"ADVANTAGE SLEEP ASSOCIATES, L.L.C.",1998 ROUTE 70 EAST,"CHERRY HILL, NJ  08003",,. CHERYL KOBITHEN,,6/17/2020,
NJ24194,COMPREHENSIVE OUTPATIENT REHAB,24194,ADVANTAGE THERAPY CENTER/ADVANTAGE SLEEP CENTERS,ADVANTAGE THERAPY CENTER/ADVANTAGE SLEEP CENTERS,"100 KINGSWAY EAST, SUITE B4-B6, WASHING PAVILIONS", ,SEWELL,NJ,08080,"SEWELL, NJ  08080",GLOUCESTER,(856) 256-0007,(856) 256-1020,cherylk@adtherapy.com,2/28/2021,"WASHINGTON TOWNSHIP CORF, L.L.C.","WASHINGTON PAVILIONS, 100 KINGSWAY EAST","SEWELL, NJ  08080",Profit - LLC,. CHERYL KOBITHEN,,6/17/2020,
NJ31C0001044,SURGICAL PRACTICE,R24524,AFFILIATED AMBULATORY SURGERY PC,AFFILIATED AMBULATORY SURGERY PC,"182 SOUTH STREET, SUITE #1", ,MORRISTOWN,NJ,07960,"MORRISTOWN, NJ  07960",MORRIS,(973) 936-1881,(973) 984-2670,R.LOMBARDI@AFFILDERMGROUP.COM,7/31/2020,"AFFILIATED AMBULATORY SURGERY, PC",182 SOUTH STREET,"MORRISTOWN, NJ  07960",Profit - Partnership,Mr. ROBERT LOMBARDI,,6/17/2020,
NJ80033,SURGICAL PRACTICE,R24501,AFFILIATED ENDOSCOPY SERVICES OF CLIFTON,AFFILIATED ENDOSCOPY SERVICES OF CLIFTON,"925 CLIFTON AVENUE, SUITE 100", ,CLIFTON,NJ,07013,"CLIFTON, NJ  07013",PASSAIC,(973) 798-6900,(973) 405-6435,affiliatedendo@optonline.net,4/30/2021,"AFFILIATED ENDOSCOPY SERVICES OF CLIFTON, LLC","925 CLIFTON AVENUE, SUITE 100","CLIFTON, NJ  07013",,Ms. SHARON JULIANO,R.N.,6/17/2020,
NJ25055,AMBULATORY CARE FACILITY,25055,AGILE URGENT CARE,AGILE URGENT CARE,20 MEADOWLANDS PARKWAY, ,SECAUCUS,NJ,07094,"SECAUCUS, NJ  07094",HUDSON,(201) 381-4800,(201) 381-4700,,6/30/2020,"AGILE URGENT CARE OF SECAUCUS, LLC",20 MEADOWLANDS PARKWAY,"SECAUCUS, NJ  07094",,Mr. RAJ SHAH,,6/17/2020,
NJ23965,PEDIATRIC COMMUNITY TRANSITIONAL HOMES,23965,AIDS RESOURCE FOUNDATION FOR CHILDREN/ST. CLARES ELIZABETH,AIDS RESOURCE FOUNDATION FOR CHILDREN,643 PEARL STREET, ,ELIZABETH,NJ,07202,"ELIZABETH, NJ  07202",UNION,(908) 351-8746,(908) 355-1708,KZEALAND@AIDSRESOURCE.ORG,6/30/2020,SAINT CLARE'S HOMES FOR CHILDREN,77 ACADEMY STREET,"NEWARK, NJ  07102",Non-Profit - Corporation,Ms. BEATRICE SIMPKINS,,6/17/2020,
NJ23963,PEDIATRIC COMMUNITY TRANSITIONAL HOMES,23963,AIDS RESOURCE FOUNDATION FOR CHILDREN/ST. CLARE'S JERSEY CITY,AIDS RESOURCE FOUNDATION FOR CHILDREN,15 CLIFTON PLACE, ,JERSEY CITY,NJ,07303,"JERSEY CITY, NJ  07303",HUDSON,(201) 435-5040,(201) 435-5586,bsimpkins@stclaresservices.org,10/31/2019,SAINT CLARE'S HOMES FOR CHILDREN,77 ACADEMY STREET,"NEWARK, NJ  07102",Non-Profit - Corporation,Ms. BEATRICE SIMPKINS,,6/17/2020,
NJ22772,AMBULATORY CARE FACILITY,22772,AIMS DIAGNOSTIC IMAGING SERVICES OF NEW JERSEY,AIMS DIAGNOSTIC IMAGING SERVICES OF NEW JERSEY,"2800 ROUTE 130 N, SUITE 202", ,CINNAMINSON,NJ,08077,"CINNAMINSON, NJ  08077",BURLINGTON,(856) 786-7044,(856) 786-7079,apsj@aimsradiology.com,7/31/2019,AIMS DIAGNOSTIC IMAGING SERVICES OF NEW JERSEY,434 NEW JERSEY AVENUE,"ABSECON, NJ  08201",,Mr. ROMESH RUTHNASWAMY,,6/17/2020,
NJ22514,AMBULATORY CARE FACILITY,22514,AIMS DIAGNOSTIC IMAGING SERVICES OF NEW JERSEY,AIMS DIAGNOSTIC IMAGING SERVICES OF NEW JERSEY,434 NEW JERSEY AVENUE, ,ABSECON,NJ,08201,"ABSECON, NJ  08201",ATLANTIC,(609) 383-0500,(609) 383-9133,apsj@aimsradiology.com,7/31/2019,AIMS DIAGNOSTIC IMAGING SERVICES OF NEW JERSEY,434 NEW JERSEY AVENUE,"ABSECON, NJ  08201",,Mr. ROMESH RUTHNASWAMY,,6/17/2020,
NJ22426,AMBULATORY CARE FACILITY,22426,"AIMS DIAGNOSTICS IMAGING SERVICES OF NJ, LLC","AIMS DIAGNOSTICS IMAGING SERVICES OF NJ, LLC",13-15 MECHANIC STREET, ,CAPE MAY COURT HOUSE,NJ,08210,"CAPE MAY COURT HOUSE, NJ  08210",CAPE MAY,(609) 465-7800,(609) 465-4419,apsj@aimsradiology.com,10/31/2019,AIMS DIAGNOSTIC IMAGING SERVICES OF NEW JERSEY,434 NEW JERSEY AVENUE,"ABSECON, NJ  08201",Profit - LLC,Mr. ROMESH RUTHNASWAMY,,6/17/2020,
NJ25035,END STAGE RENAL DIALYSIS,25035,ALARIS HEALTH DIALYSIS AT ESSEX,ALARIS HEALTH DIALYSIS AT ESSEX,155-40TH STREET, ,IRVINGTON,NJ,07111,"IRVINGTON, NJ  07111",ESSEX,(201) 216-9500,(201) 216-9656,lindad@alarishealth.com,8/31/2020,ALARIS HEALTH DIALYSIS AT ESSEX,155-40TH STREET,"IRVINGTON, NJ  07111",,Ms. ARACELI MENDOZA,,6/17/2020,
23196,END STAGE RENAL DIALYSIS,23196,ALARIS HEALTH DIALYSIS AT HAMILTON PARK,ALARIS HEALTH DIALYSIS AT HAMILTON PARK,328 NINTH STREET, ,JERSEY CITY,NJ,07302,"JERSEY CITY, NJ  07302",HUDSON,(201) 716-7700,(201) 716-7711,jsylvestre@alarishealth.com,8/29/2020,HAMILTON PARK DIALYSIS OPCO LLC,"1150 WEST CHESTNUT STREET, PO BOX 1553","UNION, NJ  07083",Profit - LLC,Ms. LEPTY BALANDRA-DWYER,,6/17/2020,
NJ25149,END STAGE RENAL DIALYSIS,25149,ALARIS HEALTH DIALYSIS AT THE CHATEAU,ALARIS HEALTH DIALYSIS AT THE CHATEAU,96 PARKWAY, ,ROCHELLE PARK,NJ,07662,"ROCHELLE PARK, NJ  07662",BERGEN,(201) 226-9600,(201) 216-9656,jsylvestre@alarishealth.com,6/30/2021,"ALARIS HEALTH DIALYSIS AT THE CHATEAU, LLC",175 BELGROVE DRIVE,"KEARNY, NJ  07032",,Ms. JOANNE SYLVESTRE,,6/17/2020,
NJ25005,AMBULATORY SURGICAL CENTER,25005,"ALFRED I DUPONT HOSPITAL FOR CHILDREN SURGERY CENTER, DEPTFORD",ALFRED I DUPONT HOSPITAL FOR CHILDREN SURGERY CENT,1280 ALMONESSON ROAD, ,DEPTFORD,NJ,08096,"DEPTFORD, NJ  08096",GLOUCESTER,(856) 345-1403,(856) 345-1406,,9/30/2020,"NEMOURS FOUNDATION, THE",10140 CENTURION PARKWAY NORTH,"JACKSONVILLE, FL  32256",,Ms. MARIELLEN DESIMONE,,6/17/2020,
NJ311812,FEDERALLY QUALIFIED HEALTH CENTERS,22657,"ALLIANCE COMMUNITY HEALTHCARE, INC","ALLIANCE COMMUNITY HEALTHCARE, INC",714 BERGEN AVENUE, ,JERSEY CITY,NJ,07306,"JERSEY CITY, NJ  07306",HUDSON,(201) 451-6300,(201) 451-0619,asimon@allliancecommunityhealth.org,1/16/2019,HORIZON HEALTH CENTER,714 BERGEN AVENUE,"JERSEY CITY, NJ  07306",Non-Profit - Corporation,Ms. MARILYN CINTRON,,6/17/2020,
311836,FEDERALLY QUALIFIED HEALTH CENTERS,22956,"ALLIANCE COMMUNITY HEALTHCARE, INC","ALLIANCE COMMUNITY HEALTHCARE, INC",115 CHRISTOPHER COLUMBUS DRIVE, ,JERSEY CITY,NJ,07302,"JERSEY CITY, NJ  07302",HUDSON,(201) 451-6300,(201) 451-0619,ASIMON@ALLIANCECOMMUNITYHEALTH.ORG,9/30/2019,HORIZON HEALTH CENTER,714 BERGEN AVENUE,"JERSEY CITY, NJ  07306",Non-Profit - Corporation,Ms. MARILYN CINTRON,,6/17/2020,
NJR24898,SURGICAL PRACTICE,R24898,"ALLIANCE SURGERY CENTER, LLC","ALLIANCE SURGERY CENTER, LLC",412 CREEK CROSSING BOULEVARD, ,HAINESPORT,NJ,08036,"HAINESPORT, NJ  08036",BURLINGTON,(856) 764-7660,(609) 261-4893,cobianwu@aol.com,12/31/2020,"ALLIANCE OB/GYN CONSULTANTS, L.L.C.",412 CREEK CROSSING BOULEVARD,"HAINSBORT, NJ  08036",Profit - LLC,Ms. KIMBERLY HARTMAN,,6/17/2020,
NJ24865,AMBULATORY CARE FACILITY,24865,ALPHA DIAGNOSTIC OF NEW JERSEY,ALPHA DIAGNOSTIC OF NEW JERSEY,1 WEST RIDGEWOOD AVENUE, ,PARAMUS,NJ,07652,"PARAMUS, NJ  07652",BERGEN,(201) 445-5055,(201) 445-5052,MOATAZ@ALPHADIAGNOSTIC.COM,6/30/2019,ALPHA DIAGNOSTIC OF NEW JERSEY,1 WEST RIDGEWOOD AVENUE,"PARAMUS, NJ  07652",Profit - LLC,Mr. MOATAZ ABDALLA,,6/17/2020,
NJ31C0001100,AMBULATORY SURGICAL CENTER,22422,AMBULATORY CARE CENTER,AMBULATORY CARE CENTER,1133 EAST CHESTNUT AVENUE, ,SOUTH VINELAND,NJ,08360,"SOUTH VINELAND, NJ  08360",CUMBERLAND,(856) 507-0800,(856) 507-0824,ASHTON@SURGERYCENTERNJ.COM,2/28/2021,"AMBULATORY CARE CENTER, P.A.",1133 EAST CHESTNUT AVENUE,"VINELAND, NJ  08360",Profit - Corporation,Ms. MELISSA HERMANSON,,6/17/2020,
NJ1090,"HOSPITAL-BASED, OFF-SITE AMBULATORY CARE FACILITY",1090,AMBULATORY CARE FACILITY AT140 E RIDGEWOOD AVENUE,AMBULATORY CARE FACILITY AT 140 E RIDGEWOOD AVENUE,140 EAST RIDGEWOOD AVENUE, ,PARAMUS,NJ,07652,"PARAMUS, NJ  07652",BERGEN,(201) 291-6321,(201) 291-6318,MMEDIAG@valleyhealth.com,10/31/2020,THE VALLEY HEALTH SYSTEM,223 NORTH VAN DIEN AVENUE,"RIDGEWOOD, NJ  07450",Non-Profit - Hospital,Ms. AUDREY MEYERS,Pres. & CEO,6/17/2020,
NJ24067,AMBULATORY SURGICAL CENTER,24067,"AMBULATORY CENTER FOR ENDOSCOPY, LLC",AMBULATORY CENTER FOR ENDOSCOPY LLC,"7600 RIVER ROAD, 4TH FLOOR", ,NORTH BERGEN,NJ,07047,"NORTH BERGEN, NJ  07047",HUDSON,(201) 705-1080,(201) 705-1090,,9/30/2020,AMBULATORY CENTER FOR ENDOSCOPY LLC,7600 RIVER ROAD,"NORTH BERGEN, NJ  07407",Profit - LLC,Ms. STELLA ZAGATA-FEE,,6/17/2020,
NJ23459,AMBULATORY SURGICAL CENTER,23459,AMBULATORY CENTER FOR EXCELLENCE IN SURGERY,AMBULATORY CENTER FOR EXCELLENCE IN SURGERY,1255 BROAD STREET, ,BLOOMFIELD,NJ,07003,"BLOOMFIELD, NJ  07003",ESSEX,(973) 842-2150,(973) 338-3545,lcando@bloomfieldsurgicenter.org,7/31/2020,BLOOMFIELD SURGI CENTER LLC,1255 BROAD STREET,"BLOOMFIELD, NJ  07003",Profit - LLC,Ms. LORNA CANDO,,6/17/2020,
NJ31C0001141,AMBULATORY SURGICAL CENTER,22900,AMBULATORY SURGERY CENTER AT OLD BRIDGE,AMBULATORY SURGERY CENTER AT OLD BRIDGE,"400 PERRINE ROAD, SUITE 408", ,OLD BRIDGE,NJ,08857,"OLD BRIDGE, NJ  08857",MIDDLESEX,(732) 553-9222,(732) 721-0828,ssamramd@aol.com,3/31/2021,"AMBULATORY SURGERY CENTER AT OLD BRIDGE, L.L.C.","400 PERRINE ROAD, SUITE 412","OLD BRIDGE, NJ  08857",Profit - LLC,. NICHOLAS BUFANO,,6/17/2020,
NJ24381,AMBULATORY SURGICAL CENTER,24381,AMBULATORY SURGERY CENTER AT VIRTUA WASHINGTON TWP,AMBULATORY SURGERY CENTER AT VIRTUA WASHINGTON TWP,"239 HURFVILLE-CROSSKEYS ROAD, SUITE 180", ,SEWELL,NJ,08080,"SEWELL, NJ  08080",GLOUCESTER,(856) 341-8262,(856) 341-8296,lbarca@VIRTUA.ORG,6/30/2021,AMBULATORY SURGERY CENTER AT VIRTUA WASHINGTON TWP,"239 HURFVILLE-CROSSKEYS ROAD, SUITE 180","SEWELL, NJ  08080",Profit - Partnership,Ms. LISA BARCA,R.N.,6/17/2020,
NJR24487,SURGICAL PRACTICE,R24487,AMBULATORY SURGICAL CENTER AT BASKING RIDGE,AMBULATORY SURGICAL CENTER AT BASKING RIDGE,140 ALLEN ROAD, ,BASKING RIDGE,NJ,07920,"BASKING RIDGE, NJ  07920",SOMERSET,(908) 604-7800,(973) 290-8370,rscott@manj.com,5/31/2020,"AMBULATORY SURGICAL CENTER AT BASKING RIDGE, L.L.C",140 ALLEN ROAD,"BASKING RIDGE, NJ  07920",Profit - LLC,Dr. RICHARD SCOTT,,6/17/2020,
NJR24612,SURGICAL PRACTICE,R24612,AMBULATORY SURGICAL CENTER AT BASKING RIDGE L.L.C.,AMBULATORY SURGICAL CENTER AT BASKING RIDGE LLC,81 VERONICA AVENUE, ,SOMERSET,NJ,08873,"SOMERSET, NJ  08873",SOMERSET,(973) 871-1229,(973) 871-1226,ccetnar@ivirma.com,8/31/2020,AMBULATORY SURGICAL CENTER AT BASKING RIDGE LLC,81 VERONICA AVENUE,"SOMERSET, NJ  08873",Profit - LLC,Ms. CECELIA CETNAR,R.N.,6/17/2020,
NJR24667,SURGICAL PRACTICE,R24667,"AMBULATORY SURGICAL CENTER OF ENGLEWOOD, LLC","AMBULATORY SURGICAL CENTER OF ENGLEWOOD, LLC",25 ROCKWOOD PLACE #105, ,ENGLEWOOD,NJ,07631,"ENGLEWOOD, NJ  07631",BERGEN,(917) 678-0079,(201) 548-5048,JAMIEGUTI@ME.COM,6/30/2020,"AMBULATORY SURGICAL CENTER OF ENGLEWOOD, LLC","25 ROCKWOOD PLACE, SUITE 105","ENGLEWOOD, NJ  07631",Profit - LLC,Dr. JAIME GUTIERREZ,,6/17/2020,
NJ90053,AMBULATORY SURGICAL CENTER,R24540,"AMBULATORY SURGICAL CENTER OF NEW JERSEY, LLC","AMBULATORY SURGICAL CENTER OF NEW JERSEY, LLC",5 PROGRESS STREET-SUITE 2, ,EDISON,NJ,08820,"EDISON, NJ  08820",MIDDLESEX,(908) 755-9671,(908) 755-9675,ascofnj@msn.com,5/31/2021,"AMBULATORY SURGICAL CENTER OF NEW JERSEY, LLC","5 PROGRESS STREET, SUITE 2","EDISON, NJ  08820",Profit - LLC,Ms. THERESA DOYLE,,6/17/2020,
NJR25143,,R25143,"AMBULATORY SURGICAL CENTER OF POMPTON LAKES, LLC","AMBULATORY SURGICAL CENTER OF POMPTON LAKES, LLC",111 WANAQUE AVENUE, ,POMPTON LAKES,NJ,07442,"POMPTON LAKES, NJ  07442",PASSAIC,(862) 330-3300,(975) 968-6660,,1/31/2021,"AMBULATORY SURGICAL CENTER OF POMPTON LAKES, LLC",111 WANAQUE AVENUE,"POMPTON PLAINS, NJ  07442",,Dr. IRFAN ALLADIN,,6/17/2020,
NJ24257,AMBULATORY SURGICAL CENTER,24257,AMBULATORY SURGICAL CENTER OF SOMERSET,AMBULATORY SURGICAL CENTER OF SOMERSET,"1081 ROUTE 22 W, SUITE 200", ,BRIDGEWATER,NJ,08807,"BRIDGEWATER, NJ  08807",SOMERSET,(908) 809-1000,(908) 809-1012,jmckibben@ascsomerset.com,6/30/2020,AMBULATORY SURGICAL CENTER OF SOMERSET,"1081 ROUTE 22 W, SUITE 200","BRIDGEWATER, NJ  08807",Profit - Corporation,Ms. JOAN MCKIBBEN,,6/17/2020,
NJ24098,AMBULATORY SURGICAL CENTER,24098,"AMBULATORY SURGICAL CENTER OF SOMERVILLE, LLC",SOMERSET AMBULATORY SURGICAL CENTER,1 ROUTE 206, ,SOMERVILLE,NJ,08876,"SOMERVILLE, NJ  08876",SOMERSET,(908) 393-8360,(908) 393-8375,lpecora@fuspi.com,3/31/2021,"AMBULATORY SURGICAL CENTER OF SOMERVILLE, LLC",1 ROUTE 206,"SOMERVILLE, NJ  08876",Profit - LLC,. DAVID ABRUTYN,,6/17/2020,
NJ1246,AMBULATORY SURGICAL CENTER,24670,AMBULATORY SURGICAL PAVILION AT ROBERT WOOD JOHNSON,AMBULATORY SURGICAL PAVILION AT ROBERT WOOD JOHNSO,"10 PLUM STREET, FOURTH FLOOR", ,NEW BRUNSWICK,NJ,08901,"NEW BRUNSWICK, NJ  08901",MIDDLESEX,(732) 289-9100,(732) 289-9130,econvery@asprwj.com,6/30/2020,AMBULATORY SURGICAL PAVILION AT ROBERT W. JOHNSON,,",   ",Profit - LLC,Ms. ELIZABETH CONVERY,R.N.,6/17/2020,
NJ24824,AMBULATORY SURGICAL CENTER,24824,AMBULATORY SURGICAL PAVILION OF NEW JERSEY,AMBULATORY SURGICAL PAVILION OF NEW JERSEY,600 S WHITE HORSE PIKE, ,HAMMONTON,NJ,08037,"HAMMONTON, NJ  08037",ATLANTIC,(609) 878-3348,(973) 968-6660,samrahat@ascbsc.com,12/31/2020,AMBULATORY SURGICAL PAVILION OF NJ,600 SO WHITE HORSE PIKE,"HAMMONTON, NJ  08038",,Mr. SAM RAHAT,,6/17/2020,
NJ317047,HOME HEALTH AGENCY,70202,AMEDISYS HOME HEALTH,AMEDISYS HOME HEALTH,"21 MAIN STREET, SUITE 252", ,HACKENSACK,NJ,07601,"HACKENSACK, NJ  07601",BERGEN,(201) 342-6311,(201) 678-9670,4201@amedisys.com,3/31/2021,"AMEDISYS NEW JERSEY, L.L.C.","3854 AMERICAN WAY, SUITE A","BATON ROUGE, LA  70816",Profit - LLC,Ms. SUSAN REYES,,6/17/2020,
NJ22614,HOSPICE CARE PROGRAM,22614,AMEDISYS HOSPICE,AMEDISYS HOSPICE,"21 MAIN STREET, SUITE 253", ,HACKENSACK,NJ,07601,"HACKENSACK, NJ  07601",BERGEN,(201) 342-7766,(201) 487-1982,4203@amedisys.com,1/31/2021,"AMEDISYS NEW JERSEY, L.L.C.","3854 AMERICAN WAY, SUITE A","BATON ROUGE, LA  70816",Profit - LLC,Ms. SHERIA BELTON,,6/17/2020,
NJ23288,AMBULATORY SURGICAL CENTER,23288,AMERICAN ACCESS CARE OF NEW JERSEY,AMERICAN ACCESS CARE OF NEW JERSEY,"207 KING HIGHWAY SOUTH, SUITE 2", ,CHERRY HILL,NJ,08034,"CHERRY HILL, NJ  08034",CAMDEN,(856) 616-8600,(856) 616-8601,allen.marcu@azuracare.com,9/30/2020,"AMERICAN ACCESS CARE OF NEW JERSEY, LLC",207 S KING HIGHWAY,"CHERRY HILL, NJ  08034",Profit - LLC,Ms. DENISE MC DONALD,,6/17/2020,
NJ23951,AMBULATORY CARE FACILITY,23951,"AMERICAN IMAGING OF UNION CITY, L.L.C.",AMERICAN IMAGING OF UNION CITY,120-152 48TH STREET, ,UNION CITY,NJ,07087,"UNION CITY, NJ  07087",HUDSON,(201) 330-1606,(201) 330-7622,,10/31/2020,HUDSON RIVER RADIOLOGY CENTER LLC,120-152 48TH STREET,"UNION CITY, NJ  07087",Profit - Individual,Mr. VICTOR TAMBINI,,6/17/2020,
NJ25106,AMBULATORY CARE FACILITY,25106,AMI ATLANTICARE,AMI ATLANTICARE,517 ROUTE 72 WEST, ,MANAHAWKIN,NJ,08050,"MANAHAWKIN, NJ  08050",OCEAN,(609) 568-9149,          ,jgorgol2aminj.com,5/31/2021,"AMI ATLANTICARE, L.L.C.","72 W. JIMMIE LEEDS ROAD, STOCKTON MB, SUITE 1100","GALLOWAY, NJ  08205",Profit - LLC,Ms. ROXANNE RIEBEL,,6/17/2020,
NJ24383,AMBULATORY CARE FACILITY,24383,AMI ATLANTICARE,AMI ATLANTICARE,219 N WHITE HORSE PIKE, ,HAMMONTON,NJ,08037,"HAMMONTON, NJ  08037",ATLANTIC,(609) 878-9729,(609) 561-1758,gackerman@atlanticmedicalimaging.com,11/30/2020,"AMI ATLANTICARE, L.L.C.","72 W. JIMMIE LEEDS ROAD, STOCKTON MB, SUITE 1100","GALLOWAY, NJ  08205",Profit - LLC,Ms. KATHERINE BOURGKOIS,,6/17/2020,
